[
    {
        "_id": 9,
        "code": "TABLE-B-ATTR2",
        "name": "Table B Attr2",
        "data_type": "STRING",
        "_class": "COLUMN"
    },
    {
        "_id": 8,
        "code": "TABLE-B-ATTR1",
        "name": "Table B Attr1",
        "data_type": "STRING",
        "_class": "COLUMN"
    },
    {
        "_id": 7,
        "code": "TABLE-A-ATTR2",
        "name": "Table A Attr2",
        "data_type": "STRING",
        "_class": "COLUMN"
    },
    {
        "_id": 6,
        "code": "TABLE-A-ATTR1",
        "name": "Table B Attr1",
        "data_type": "STRING",
        "_class": "COLUMN"
    },
    {
        "_id": 5,
        "code": "TABLE-B-ID",
        "name": "Table B ID",
        "data_type": "INTEGER",
        "_class": "COLUMN"
    },
    {
        "_id": 4,
        "code": "TABLE-A-ID",
        "name": "Table A ID",
        "data_type": "INTEGER",
        "_class": "COLUMN"
    }
]
